<?xml version="1.0" encoding="UTF-8"?>
<cancion duracion="4:47" año="2008" xmlns:xs="http://www.w3.org/2001/XMLSchema-instance" xs:noNamespaceSchemaLocation="esquema3.xsd">
<titulo>Give it 2 me</titulo>
<compositores>
<compositor>
<nombre>Pharrell</nombre>
<apellido>Williams</apellido>
</compositor>
</compositores>
<productores>
<productor>
<nombre>Pharrell</nombre>
<apellido>Williams</apellido>
</productor>
</productores>
<sello>Warner Bros. Records</sello>
<artista>Madonna</artista>
</cancion>